actor,movie_or_TV_name
Jack Black,"Oh Hell No,Untitled Illumination Entertainment Project,Apollo 10½,Borderlands,Psychonauts 2,Waffles + Mochi,Tony Hawk's Pro Skater 1 + 2,Home Movie: The Princess Bride,Jumanji: The Next Level,Tenacious D: Post-Apocalypto,Goosebumps 2: Haunted Halloween,The House with a Clock in Its Walls,Unexpected Race,The Aquabats! Radventures!,Drunk History,Gorillaz: Humility,Don't Worry, He Won't Get Far on Foot,Nick Jonas & Jack Black: Jumanji Jumanji,Jumanji: Welcome to the Jungle,The Last Man on Earth,Tommy Can't Sleep,The Polka King,Great Minds with Dan Harmon,Kung Fu Panda 3,Kung Fu Panda: Secrets of the Scroll,The Little Shop of Monsters,Goosebumps,Documentary Now!,The Brink,Another Period,Welcome to Sweden,Workaholics,The D Train,Die Antwoord: Ugly Boy,Meet Me at the Reck,'Weird Al' Yankovic: Tacky,Sex Tape,Broken Age,Ambiance Man,Tenacious D: Where Have We Been,Metalocalypse,Metalocalypse: The Doomstar Requiem - A Klok Opera,Ghost Ghirls,OFF! - Wrong with Jack Black,First Look: Ultimate Teaser Trailer,Tenacious D: Rock Is Dead,Tenacious D: Low Hangin' Fruit,The Roadie,Tenacious D: Rize of the Fenix,Tenacious D: To Be the Best,Kung Fu Panda: Secrets of the Masters,The Muppets,The Big Year,Bernie,Kung Fu Panda 2,Beastie Boys: Make Some Noise,Shalom Sesame,Beastie Boys: Fight for Your Right Revisited,Gulliver's Travels,Kung Fu Panda Holiday,iCarly,The Mis-Informant - with Jack Black as Nathan Spewman,Drunk History,Community,Brütal Legend,Year One,In the Attic with Pete Townshend & Friends,The Office,Water and Power,Cee-Lo Green: Kung Fu Fighting,Prop 8: The Musical,Kung Fu Panda: Secrets of the Furious Five,Tenacious D: The Complete Masterworks 2,ADHDtv: With Lew Marklin,Tropic Thunder: Rain of Madness,Tropic Thunder,Kung Fu Panda,Be Kind Rewind,Walk Hard: The Dewey Cox Story,The Simpsons,Margot at the Wedding,Exposure,The Naked Trucker and T-Bones Show,The Holiday,Tenacious D: Time Fixers,Tenacious D: Classico,Tenacious D: POD,Tenacious D in the Pick of Destiny,Eagles of Death Metal: I Want You So Hard (Boy's Bad News),Nacho Libre,Danny Roane: First Time Director,Awesometown,King Kong,King Kong: The Official Game of the Movie,Laser Fart,Club Oscar,Tom Goes to the Mayor,Shark Tale,Anchorman: The Legend of Ron Burgundy,Envy,Cracking Up,Foo Fighters: Low,Computerman,Time Belt,Player$,Will & Grace,School of Rock,Dio: Push,Melvin Goes to Dinner,The Andy Dick Show,The Lewis Lectures,Clone High,Jack Black: Spider-Man,Lord of the Piercing,Tenacious D: Tribute,Ice Age,Run Ronnie Run,Orange County,Shallow Hal,Tenacious D: Wonderboy,Frank's Book,Tenacious D: Fuck Her Gently,Saving Silverman,Tenacious D,High Fidelity,Heat Vision and Jack,Beck: Sexx Laws,Foo Fighters: Learn to Fly,Jesus' Son,The Love Letter,Cradle Will Rock,Enemy of the State,I Still Know What You Did Last Summer,Bongwater,Johnny Skidmarks,The Jackal,Mr. Show with Bob and David,Mars Attacks!,Crossworlds,The Fan,The Cable Guy,Picket Fences,Bio-Dome,Dead Man Walking,The Single Guy,Touched by an Angel,The X-Files,Waterworld,Pride & Joy,Bye Bye Love,All-American Girl,The NeverEnding Story III,The Innocent,Blind Justice,Northern Exposure,Demolition Man,Airborne,Marked for Murder,Life Goes on,Great Scott!,The Golden Palace,Bob Roberts,Our Shining Moment,Too Far from Norm,The Fall Guy"
Kara Elizabeth Silva,"The Back-up Plan,10 Things I Hate About You,Eleventh Hour,The Office"
Trevor Anthony Pitzel,"Love and Board Games,The Suicide of Lillian Sellers,Swiped,Drafted,Why the Chicken Crossed the Road,Nashville,Once, with Maggie,Number 33,A Father's Love,Grey's Anatomy,My Krazy Ex,Fratitude,Young American Dream,Movember Grabs Balls,GTOtv,Starbucks Drake Hands Parody,Modern Family,Fratitude,Making Change,Muladhara,Pits,Lucifer Loves Roast Beef,Uninvited,The Office,Picnic"
Alina Andrei,"Obi-Wan Kenobi,The Orville,American Horror Story,The Suicide Squad,Danger Force,Rebel,The Walking Dead,Godzilla vs. Kong,Fear the Walking Dead,Lucifer,Birthmother's Betrayal,The Wrong Missy,Reno 911!,Deputy,Station 19,A Dark Foe,Chicago P.D.,9-1-1: Lone Star,Grace and Frankie,Medical Police,Jackboys: Jackboys,Runaways,9-1-1,Acceleration,Baskets,Yellowstone,Animal Kingdom,Prey,Henry Danger,Sneaky Pete,You're the Worst,Criminal Minds,Angie Tribeca,Midnight, Texas,Snowfall,Breaking In,Lethal Weapon,Inhumans,Ghosted,Brooklyn Nine-Nine,American Housewife,The Night Shift,Transformers: The Last Knight,Hawaii Five-0,Going in Style,MacGyver,Ingrid Goes West,New Girl,Patriots Day,Time Framed,Code Black,Pretty Little Liars,Mother, May I Sleep with Danger?,Kingdom,Childrens Hospital,Vinyl,Love Is All You Need?,Scorpion,Colony,Workaholics,Risk for Honor,Agent X,How to Get Away with Murder,Ominous,Stitchers,Bones,Furious 7,Castle,Grimm,Mighty Med,Sons of Anarchy,Burying the Ex,Prophecy of Eve,The Purge: Anarchy,Zombeavers,Extraction,Zephyr Springs,Rites of Passage,iCarly,CSI: Miami,Leverage,Happy Endings,Thor,Water for Elephants,House,Bare Knuckles,Hard Breakers,Undercovers,The Mentalist,The Event,The Sorcerer's Apprentice,Desperate Housewives,Flashforward,La fleur de la bataille,Live Evil,Trauma,Numb3rs,Monk,The Cleaner,A Perfect Getaway,The Closer,The Dream of Alvareen,Prison Break,Life,24,Eleventh Hour,17 Again,Cold Case,The Shield,Do Not Disturb,Eve,Stiletto,The Office,Asylum,Lost,Knight Rider,Company Man,Dexter,ER,Passions,NCIS,Transformers,Day Break,Dead & Deader,Justice,Charmed,CSI: NY,The Crusader"
Darren Bailey,"Shang-Chi and the Legend of the Ten Rings,Free Guy,Jungle Cruise,Loki,Space Jam: A New Legacy,Black Widow,The Falcon and the Winter Soldier,The Mandalorian,Thorns,Dolittle,Star Wars: Episode IX - The Rise of Skywalker,Lady and the Tramp,Playing with Fire,The Irishman,Gemini Man,Fast & Furious Presents: Hobbs & Shaw,Spider-Man: Far from Home,X-Men: Dark Phoenix,Avengers: Endgame,Water Horse,Captain Marvel,Alita: Battle Angel,Mortal Engines,Bumblebee,Fantastic Beasts: The Crimes of Grindelwald,They Shall Not Grow Old,The Predator,Teen Titans GO! To the Movies,Skyscraper,Ant-Man and the Wasp,Jurassic World: Fallen Kingdom,Solo: A Star Wars Story,Avengers: Infinity War,Rampage,Ready Player One,Black Panther,Maze Runner: The Death Cure,Star Wars: Episode VIII - The Last Jedi,Geostorm,Thor: Ragnarok,Blade Runner 2049,Kingsman: The Golden Circle,War for the Planet of the Apes,Spider-Man: Homecoming,The Mummy,King Arthur: Legend of the Sword,Guardians of the Galaxy Vol. 2,The Fate of the Furious,xXx: Return of Xander Cage,Assassin's Creed,Rogue One: A Star Wars Story,Fantastic Beasts and Where to Find Them,Doctor Strange,Miss Peregrine's Home for Peculiar Children,Star Trek Beyond,Independence Day: Resurgence,The BFG,X-Men: Apocalypse,Captain America: Civil War,Star Wars: Episode VII - The Force Awakens,Point Break,Everest,Maze Runner: The Scorch Trials,Ant-Man,Terminator Genisys,Jurassic World,San Andreas,Mad Max: Fury Road,Avengers: Age of Ultron,The SpongeBob Movie: Sponge Out of Water,Exodus: Gods and Kings,Deepsea Challenge,Teenage Mutant Ninja Turtles,Hercules,Guardians of the Galaxy,X-Men: Days of Future Past,Godzilla,Transcendence,Captain America: The Winter Soldier,Noah,Need for Speed,47 Ronin,Thor: The Dark World,Percy Jackson: Sea of Monsters,R.I.P.D.,The Wolverine,Pacific Rim,Star Trek Into Darkness,Iron Man 3,G.I. Joe: Retaliation,Jurassic Park,Terminator 2: Judgment Day"
Linda Weinrib,"Battle in Space: The Armada Attacks,Sharon Is Karen,Regionrat,The Hug,Life Is Strange 2,Peace by Piece,Overnights,My BFF Satan,Sex and Violence! or: A Brief Review of Simple Physics,Life Is Horrible,Opus of an Angel,The Boogeys,Modern Family,Eden,Eight Crazy Dates,First Love,Only God Can,Bozos,The Birthday Boys,Heartbreakers,Karaoke!,We Are Voice Actors!,Ultraman Saga,Ultraman Zero: The Revenge of Belial,Net Ghost PiPoPa,The Office,Cy Girls,Skinned Deep,Little Dreams,I My Me! Strawberry Eggs,NieA under 7,Angel with an Attitude,Amazing Nurse Nanako,Shanghai: Second Dynasty,The Pornographer,Night Wings"
Cooper Thornton,"Four Leaf Clover,Something's More Than One Thing,2 Minutes of Fame,The Resident,Miss Virginia,El Camino Christmas,Sully,NCIS: New Orleans,In-Between,The Submarine Kid,Dig,Gone Girl,Atlas Shrugged: Who Is John Galt?,Killing Happy,Artful Gambit,Walk of Shame,Parks and Recreation,Dads,The Congress,NCIS,Tomb Raider,A Good Day to Die Hard,The Truth About Emanuel,NCIS: Los Angeles,Weeds,Fred: The Show,Inside,Justified,I Am Number Four,Red State,The Whole Truth,Jeffie Was Here,Brothers & Sisters,Three Rivers,Samantha Who?,Changeling,My Name Is Earl,Curb Your Enthusiasm,Cold Case,Fracture,Zodiac,The Office,House,Justice,All of Us,Property,Hannah Montana,Close to Home,Arrested Development,The Bernie Mac Show,The King of Queens,Run,Las Vegas,Flightplan,The Ring Two,American Dreams,Second Time Around,Hawaii,The District,House of Sand and Fog,One on One,CSI: Crime Scene Investigation,Meet the Marks,Family Law,The Drew Carey Show,Grounded for Life,The Parkers,The Practice,The Guardian,Scrubs,Judging Amy,The Last Dance,Going Home,Santa and Pete,Blue Valley Songbird,Existo,Following Her Heart"
Laura Jean Leal,"The Punisher,State of Affairs,The Bridge,Trauma"
Crystal Havens,"Star Trip,Affairs in Order,Alondra Smiles,Downsized,The Office,The O.C.,Without a Trace,Sometimes Sorrow Looks Like Elaine"
Brian A. Gutierrez,"The Sinners,Criminal Minds,The Smell of Success,The Office"
Lynnanne Zager,"Deadly Women,For All Mankind Time Capsule,Corked,The SpongeBob Movie: Sponge on the Run,Harvey Girls Forever!,Need for Speed: Heat,Haunt,The Angry Birds Movie 2,3Below: Tales of Arcadia,The Twilight Zone,Just Getting Started,The Star,Captain Underpants: The First Epic Movie,The Boss Baby,Heroes Reborn,Kung Fu Panda 3,Hotel Transylvania 2,Extant,Penguins of Madagascar,The Book of Life,Dawn of the Planet of the Apes,Kahlil Gibran's The Prophet,House of Cards,Mr. Peabody & Sherman,Reaver,N.Y.C. Underground,Syndicate,Days of Our Lives,That's What I Am,Dead Space: Aftermath,My Soul to Take,Dante's Inferno,Star Trek,Bride Wars,Madagascar: Escape 2 Africa,Army Wives,Fly Me to the Moon 3D,The Office,American Pastime,Criminal Minds,Three Moons Over Milford,Fatal Contact: Bird Flu in America,Lost,The Madagascar Penguins in a Christmas Caper,The Incredible Hulk: Ultimate Destruction,Fantastic Four,Medium,I, Robot,Timecop: The Berlin Decision,And Starring Pancho Villa as Himself,Six Feet Under,Oh Baby,Jerry Maguire,Roseanne,ER,Beverly Hills Cop III,Angel of Fury,The Smurfs,Casual Sex?,Fatal Attraction,Airwolf,Going Bananas,Nausicaä of the Valley of the Wind"
David L. Marston,"Bad Boys for Life,The Walking Dead,Once Upon a Time... In Hollywood,John Wick: Chapter 3 - Parabellum,The Dirt,All Eyez on Me,Sleepless,Get Hard,American Sniper,Guardians of the Galaxy,Captain America: The Winter Soldier,Thor: The Dark World,Iron Man 3,House of Cards,The Avengers,Thor,Limitless,Red Dead Redemption: Undead Nightmare,Iron Man 2,The Incredible Hulk,21,The Office,CSI: NY,The Wire,Annapolis,Ladder 49,The Sum of All Fears,The Replacements,Homicide: Life on the Street,Enemy of the State,Bullet,Serial Mom,Major League II,Dazed and Confused,Gleaming the Cube,Hairspray"
Austin Michael Scott,"The Clinic,MasterChef Junior,MasterChef USA,Stand by You,Dancing with the Stars,Game On!,Lego Masters,Double Dare,The World's Best,The Masked Singer,The Four: Battle for Stardom,Little Big Shots,BattleBots,iHeartRadio Music Awards 2018,Total Divas,Undressed,SafeWord,Food Network Star,Caraoke Showdown,Project Runway Junior,Penn & Teller: Fool Us,Who Wants to Be a Millionaire,Flipping Out,Pleasure Dome: February 26th, 1981,9-1-1 Encounters,Young & Hungry,Guy's Grocery Games,A Wicked Offer,Get Swank'd,West Texas Investors Club,Monopoly Millionaires' Club,How to Be a Grown Up,Rev Run's Happy Holidays,Hollywood Game Night,The Writers' Room,My Big Fat Geek Wedding,Chef Wanted with Anne Burrell,The Winner Is,Exit,Robot Combat League,Night Crew,Unsealed: Alien Files,Unsealed: Conspiracy Files,Breaking Wind,Mr. Considerate,Good Night, Sleep Tight 2: Rise and Shine,Breathless,Good Night, Sleep Tight,The Answering Machine,Voodoo,Debt,In Gayle We Trust"
Gregory Graham,"Young Again,The Big Noir,The Big Noir,The Big Noir 2,Caravaggio and My Mother the Pope,Sangre Negra,13 Mysteries,CEO,The Unhandymen,Dead Maker,The Psychologist: A Comedy Web Series,Sing About It,Undone,Natural Born Filmmakers,Happy Hilda,Vrem,Heavy Metal Greg Goes to the Grammys,Next,From Salerno with Love,Intimate Temp Agency,Immorta,Bad Man,Slam Dance,Omadox,Section 8,It's Dark Here,Victoria's Secret,Young American Dream,Not So Young,Brahmin Bulls,Madden Girl,In the Way,Distant Location,Gossip Boy,Painkiller,Being Vanessa,Color of Honor,Fabulous High,First in Flight,In Half,Shade of Blue,Tears,The Creepy Guy,The Shop,Heroine Legends,The Color of Christmas,The Spirit of 4/20,Borderline Coyotes,Wash Me,Useless,Vicious Circle,AmerAsian,Trust Me,Revamped,Choose Connor,The Riches,The Office,CSI: Miami,Cold Case,My Name Is Earl,What About Brian,Friends,The Ellen Show,Robbery Homicide Division,The Country Bears,They Crawl,The Huntress"
Robert Foreman,"Not Another B Movie,The Office,Rumor Has It...,Curb Your Enthusiasm,Space Daze,Judging Amy,Goggles,The Prodigy"
Susie Geiser,"I Just Wish You Told Me,Good Girls,Booked It!,Raising Hope,General Hospital,Karma's a B*tch,Weeds,Shameless,Karma's a Bitch,The Middle,Numbers,Samantha Who?,Hannah Montana,Eli Stone,The Office,Gilmore Girls,The West Wing,Will & Grace,Futurama,Toonsylvania,Men Behaving Badly,Sherman Oaks"
Patrick Bradford,"Sasquatch,Alpha House,Arrow,The Other Country: Starring Burlap to Cashmere,A Turtle's Tale 2: Sammy's Escape from Paradise,Sand Sharks,Herd Mentality,Great Expectations,Bones,Happy Endings,Law & Order: Special Victims Unit,Sharktopus,The Mentalist,Sherlock,Dinoshark,NCIS: Los Angeles,Community,Chuck,Fringe,CSI: Miami,Burn Notice,A Fox's Tale,The Office,The Kill Point,Chupacabra,Victoria Cross Heroes,The Underground,Dexter,House,Lost,Suburban Shootout,Scrubs"
James M. Halty,"Spenser Confidential,Black Panther,Curb Your Enthusiasm,Wonder Woman,The Magnificent Seven,Batman v Superman: Dawn of Justice,Run All Night,Taken 3,300: Rise of an Empire,The List,R.I.P.D.,Snitch,True Blood,Mud,A Thousand Words,Friends with Benefits,Burlesque,Date Night,Crash Course,Hung,Lie to Me,Criminal Minds,Fast & Furious,Hotel for Dogs,Meet Dave,Wanted,Iron Man,Street Kings,21,The Eye,Californication,License to Wed,Evan Almighty,The Invasion,Georgia Rule,Monster House,Southland Tales,The Shaggy Dog,The Darwin Awards,Santa's Slay,Domino,The Third Vehicle,Mr. & Mrs. Smith,xXx: State of the Union,The SpongeBob SquarePants Movie,National Treasure,First Daughter,Collateral,Hidalgo,Looney Tunes: Back in Action,The Cat in the Hat,Seabiscuit,Hollywood Homicide,44 Minutes: The North Hollywood Shoot-Out,Daredevil,CSI: Miami,Trapped,xXx,I Am Sam,American Outlaws,America's Sweethearts,Dr. Dolittle 2,The Fast and the Furious,Spy Kids,15 Minutes,Roswell,Forever Lulu,The Patriot,Gone in 60 Seconds,Here on Earth,End of Days,Hard Time: Hostage Hotel,D.R.E.A.M. Team,Blue Streak,Fight Club,Stigmata,Replacing Dad,Gloria,The Adventures of Ragtime,Soldier,Practical Magic,Lethal Weapon 4,The X Files,Doctor Dolittle,Godzilla,Species II,Desperate Measures,Phantoms,Gang Related,Most Wanted,Trojan War,Fire Down Below,Leave It to Beaver,Breakdown,Volcano,The Inheritance,Dante's Peak,Christmas Every Day,Star Trek: First Contact,High School High,Courage Under Fire,The Rock,Twister,Unforgivable,The Big Green,An Element of Truth,Virtuosity,Waterworld,The Indian in the Cupboard,Apollo 13,Liz: The Elizabeth Taylor Story,Bye Bye Love,Tad,Trick of the Eye,Little Giants,Full Eclipse,Demolition Man,The Ballad of Little Jo,Last Action Hero,Warlock: The Armageddon,Breaking the Rules,Captain Ron,Patriot Games,American Me,Memoirs of an Invisible Man,Radio Flyer,Hook,Dollman,A Woman Named Jackie,Ricochet,Bill & Ted's Bogus Journey,Don't Tell Mom the Babysitter's Dead,A Girl to Kill For,Almost an Angel,Running Against Time,Predator 2,The Hot Spot,Midnight Ride,Die Hard 2,Ghost Dad,Impulse,The Last of the Finest,Heart Condition,Tango & Cash,The Wizard,The Wonder Years,Lethal Weapon 2,Star Trek V: The Final Frontier,Road House,K-9,Rescue 911,Dead Bang,Police Academy 6: City Under Siege,Out Cold,I'm Gonna Git You Sucka,Caddyshack II,License to Drive,Patty Hearst,The Seventh Sign,Alien from L.A.,Leonard Part 6,The Wild Pair,Code Name Zebra,Big Shots,High Tide,The Untouchables,Nightforce,The Hanoi Hilton,Number One with a Bullet,Over the Top,Body Slam,Modern Girls,The Boy Who Could Fly,Airwolf,To Live and Die in L.A.,Warning Sign,Secret Admirer,Moving Violations,2010: The Year We Make Contact,Ghost Warrior,Dreamscape,Cannonball Run II,Star Trek III: The Search for Spock,Up the Creek,D.C. Cab,Scarface,Dynasty,The Star Chamber,Stroker Ace,Blade Runner,Fighting Back,Pandemonium,The Border,The Seduction,Body Heat,Choices,The Cannonball Run,History of the World: Part I,Caveman,The Legend of Sleepy Hollow,Smokey and the Bandit II,Herbie Goes Bananas,The Blues Brothers,National Lampoon's Animal House,Zero to Sixty,Corvette Summer,The End,Gray Lady Down,Looking for Mr. Goodbar,Herowork,Another Man, Another Chance,Audrey Rose,Two-Minute Warning,Drum,Silent Movie,Won Ton Ton: The Dog Who Saved Hollywood,The Missouri Breaks,The Hindenburg,Peeper,Crazy Mama,W.W. and the Dixie Dancekings,The Day of the Locust,Planet of the Apes,The Longest Yard,Sleeper,The Stone Killer,Shamus,The Mechanic,The Culpepper Cattle Co.,Something Big,Little Big Man"
David Daskal,"The Day I Woke Up,Soaked in Bleach,Neighbors,Vox Influx,Did the Dog Really Eat It?,Silicon Valley,A God Named Pablo,The Adventures of Lewis & Clark,Redwood,Kirk Cameron,Issues,Nine-Tenths of the Law,Replacing Death,Pox,Party Foul,The Waiting Room,Match,Rooftop,Hollywood and Vine,The Office,Drake & Josh,Saints Row,Accepted,Six Feet Under,Sleepover,My Grapefruit, My Father,Win a Date with Tad Hamilton!,The Bernie Mac Show,The West Wing"
Randy Vinneau,"On Air,American Curry Pie,Crash: The Animated Series,Back to Zero,Across the Pond,Crash: The Animated Movie,Last Call,The Galam,The Man in Black,The Day I Don't Remember,The Man in Grey,Crash,The Man in Red,Abstract Underwraps,The Dating Game,The Art of the Interview,Forgotten/Remembered,The Combination,Dockweiler,Las Vegas,Without a Trace,Numb3rs,Invasion,CSI: NY,7th Heaven,The O.C.,Courting Alex,How I Met Your Mother,The Office"
Stephen Pisani,"Castle,Standoff,Damages,Without a Trace,Strong Medicine,The Office,Roswell,Star Trek: Voyager,See Jane Run,Delivering Milo,Star Trek: Deep Space Nine"
Miriam Tolan,"At Home with Amy Sedaris,Escape from Virtual Island (Audible Original - Audio Comedy),Jon Glaser Loves Gear,The Shivering Truth,Rough Night,Thanksgiving,The Untitled Web Series That Morgan Evans Is Doing for MTV,Bad Judge,Broad City,Hello Ladies,The Millers,The League,The Heat,Late Night with Jimmy Fallon,Girls,Full on Koechner,Breaking the News,Childrens Hospital,The Front Desk,The Dictator,High Road,Pretend Time,I Hate Valentine's Day,Delocated,Mayne Street,Z Rock,The Line,30 Rock,Human Giant,Suburban Bravery,The Jeannie Tate Show,The Office,Late Night with Conan O'Brien,Martin & Orloff,Saturday Night Live,Upright Citizens Brigade,Lois Kaz,Jazz Freddy"
Cora Skinner,"Kittens of the Desert,Rules of Engagement,The Tonight Show with Jay Leno,Las Vegas,Shark,CSI: Miami,The Office"
Angelo Middione,"Untold Stories of the ER,Veronica Mars,Desire,The Office"
Kate Quigley,"What's Wrong with Men?,The Big Picture,iListen,Add-TV,Gentlemen Only Ladies Forbidden: Puddy McFadden License to Golf,What Happened in Babylon... History Explained,Guber,My Super-Overactive Imagination,Apartment 9,Tattoo Nightmares,Talkshow with Spike Feresten,Star Trek: Hidden Frontier,The Danny Comden Project,The Office"
John H. Tobin,"Faith of Our Fathers,Black Martini,Saving Mr. Banks,The Face of Love,Saving Lincoln,Gangster Squad,The Guilt Trip,The Master,Argo,Somewhere Far,Chuck,Transformers: Dark of the Moon,The Artist,Dome Project,Numb3rs,CSI: Crime Scene Investigation,Mad Men,Changeling,Indiana Jones and the Kingdom of the Crystal Skull,Columbus Day,Afuera,Saving Grace,Company Town,Bottoms Up,Bobby,The Office,Mission: Impossible III,Bones,My Name Is Earl,Nip/Tuck,Mrs. Harris,The Devil's Rejects,Wedding Crashers,Gilmore Girls,Desperate Housewives,A Cinderella Story,The West Wing,Curb Your Enthusiasm,Las Vegas,Line of Fire,Something's Gotta Give,Frasier,The Guardian,The Practice,Alex & Emma,The Italian Job,Lucky,Will & Grace,MDs,Far from Heaven,I'm with Lucy,Unfaithful,Changing Lanes,A Beautiful Mind,Deadline,100 Centre Street,Law & Order,The Cider House Rules,Sweet and Lowdown,Grace & Glorie,Witness to the Mob,Amistad,Hackers,Against the Law,One Life to Live,The Kennedys of Massachusetts,Everybody Wins,UFO: Target Earth"
Ian Novotny,"CSI: NY,True Jackson, VP,Numb3rs,Monk,Eli Stone,Without a Trace,Tropic Thunder,Saving Grace,Women's Murder Club,Dirt,Medium,Journeyman,Criminal Minds,My Boys,Close to Home,Vanished,Windfall,Just Legal,24,Jake in Progress,Freddie,Survivor,ER,Sex, Love & Secrets,Inconceivable"
Sherry Landry,"Tosh.0,Southland,CSI: Crime Scene Investigation,Chuck,The Office"
Lianne Lin,"From Start to Finish,Perfect Girl,Colored Hearts,What You Don't Say,It's a Love Thing"
Kayla Mae Maloney,"The Following,Nonalcoholism,The Glades,Undercover Bridesmaid,The Touch,Lie to Me,Memphis Beat,The Good Guys,Supernatural,Saving Grace,CSI: Miami,NCIS,Cold Case,Heartland,Crossing Jordan,CSI: Crime Scene Investigation,You've Reached the Elliotts,Criminal Minds,The Office,Boston Legal,Bones,Without a Trace,Medical Investigation,Strong Medicine,Judge Koan"
Steven Cortinas,"Spoiler Alert,American Trash,The Interview,The Problem Solver,CSI: Crime Scene Investigation,The Big Dick Mike Show,The Office"
Sean R. Lake,"American Housewife,The Cookie Mobster,J. Edgar,Horrible Bosses,Saving Grace,Everybody Hates Chris,Pushing Daisies,Jane Doe: Eye of the Beholder,Ocean's Thirteen,Alias,CSI: NY,Crossing Jordan,The West Wing,Related,The Office,The Hidden"
Joey Basu,Modern Marvels
Conan O'Brien,"Conan,5th Annual NFL Honors,The Flaming C,2014 MTV Movie Awards,2013 White House Correspondents' Association Dinner,The Tonight Show with Conan O'Brien,Late Night with Conan O'Brien,Andy Barker, P.I.,The 58th Annual Primetime Emmy Awards,Saturday Night Live: The Best of Jon Lovitz,Late Night with Conan O'Brien: 10th Anniversary Special,The 54th Annual Primetime Emmy Awards,50 Years of NBC Late Night,Saturday Night Live 25,Late Night with Conan O'Brien: 5,Saturday Night Live: The Best of Phil Hartman,Dr. Katz, Professional Therapist,The Simpsons,Best of Saturday Night Live: Special Edition,Lookwell,Saturday Night Live,The Wilton North Report,The Rich Hall Show,Not Necessarily the News"
Kendra Cannoy,"Kidnapped,Four Kings,The Office,Sex, Love & Secrets,24: Conspiracy,Passions,Port Charles"
Chelsey Crisp,"Call My Agent (UK),Bucktown,CSI: Vegas,Young Rock,Fresh Off the Boat,Life with Dog,Surviving Theater 9,The Outdoorsman,Clawed,Just Do You,The 60 Yard Line,In-Lawfully Yours,Bleed,The League,The Grinder,What's Your Emergency,10 Things I Hate About Life,Duchess Riot Shorties,NCIS: New Orleans,A to Z,Adult All Girl Sexy Sleep Over Party,Rake,#InstaFamous: How to Become Famous on Instagram,We Are Men,ACME Hollywood Dream Role,Chicken Suit,Marvin Marvin,New Girl,Couchers,The Joe Schmo Show,Mike & Molly,Rizzoli & Isles,Happy Endings,Mädchen,Adopting Terror,McCracken Live!,Desire and Deceit,Better Off Ted,Reconciliation,NCIS,An American Standard,Journeyman,CSI: Miami,The Office,Extra,Threshold,Dr. Chopper"
Sunah Bilsted,"Corporate,The Angriest Man in Brooklyn,Awesome Asian Bad Guys,#twitterkills,Brightest Star,Hung,Jason Nash Is Married,Party Down,Happythankyoumoreplease,Factory,The Grass Is Greener,What About Brian,The Office,Wanted,Alias,High Life,Jack & Jill,Last Call"
John Alton,"Motel Evil,Stay,Frog Catcher,Please Hold,Dina and Donnie: How's the Weatha'?,Off the Cuff: Healthy Cooking with Craig Mitchell,Entering the Unknown,How To Get Out of Jury Duty,Betrayed,Oh, It's Nothing,Ready,How to Get Out of a Speeding Ticket,Back Stabber,Your Old Man,Hacks,Mr. Goode,Hiker,Twelve,Fresh Off the Boat,Starship: Apocalypse,Starship: Rising,Odd Brodsky,Dark Space,The Russian Spy,Wilfred,The Cynical Life of Harper Hall,The Assignment,Spork,Humanity's End,Gilmore Girls,The Office,Stand Up,The Big Bang"
Randall Barnwell,"The Office,The Hollow Men,Oliver Beene,Ghost World,Eminem: E"
