actor,movie_or_TV_name
Amy Hill,"UDrive Me,Mack & Rita,Ready Forward,Magnum P.I.,Doogie Kamealoha, M.D.,Yasuke,Big City Greens,Outdated,Cleopatra in Space,Boy Luck Club,Comisery,American Dad!,It's Pony,Costume Quest,Kung Fu Panda: The Paws of Destiny,Remind Me,Just Add Magic,3 Year Plan,Santa Clarita Diet,Black-ish,Crazy Ex-Girlfriend,Untitled Single Dad Project,Mom,Preacher,The Emoji Movie,Spider-Man: Homecoming,The Great Indoors,Catfight,UnREAL,Lego DC Comics Superheroes: Justice League - Gotham City Breakout,Comedy Bang! Bang!,Kung Fu Panda: Legends of Awesomeness,Coffee House Chronicles,The Unbidden,Punching Henry,Life in Pieces,The Sibling Code,Family Fortune,Imperfect Sky,Man Up,Sanjay and Craig,Jessie,Hawaii Five-0,Sean Saves the World,The League,The Legend of Korra,Big Gay Love,You and Your Fucking Coffee,Arrested Development,Lauren,Enlightened,The Office,Squad 85,World of Warcraft: Mists of Pandaria,Retired at 35,Family Restaurant,Raising Hope,The Crumbles,White Frog,Family Practice,Reed Between the Lines,State of Georgia,The Mentalist,Geisho,Law & Order: LA,Two and a Half Men,Curious George,Castle,Glee,Numb3rs,Couples Retreat,The Goode Family,Curious George 2: Follow That Monkey!,DJ & the Fro,General Hospital,Legally Blondes,Medium,Eli Stone,Ghost Whisperer,The Return of Jezebel James,Boston Legal,American Family,South of Pico,Grey's Anatomy,The Sarah Silverman Program.,Legion of Super Heroes,Studio 60 on the Sunset Strip,In Case of Emergency,Finishing the Game,Let's Go to Prison,American Dragon: Jake Long,The Life and Times of Juniper Lee,Lilo & Stitch: The Series,Just for Kicks,Desperate Housewives,Unbeatable Harold,Related,Hot Properties,Kids in America,Avatar: The Last Airbender,The Closer,Herbie Fully Loaded,Jackie Chan Adventures,That's So Raven,Jake in Progress,Duck,North Shore,Without a Trace,Hot Momma,Six Feet Under,Reno 911!,Kim Possible,50 First Dates,Cheaper by the Dozen,The Cat in the Hat,Eve,King of the Hill,Frasier,Still Standing,The Basil Brush Show,MDs,When Angels Cry,Lilo & Stitch,The Proud Family,Man of the Year,Andy Richter Controls the Universe,One on One,Big Fat Liar,The Bernie Mac Show,Curb Your Enthusiasm,My Wife and Kids,The Mummy,Bob Patterson,Max Keeble's Big Move,The Wild Thornberrys: The Origin of Donnie,The New Women,Virtually Casey,Pavilion of Women,Bette,On Edge,Strip Mall,3rd Rock from the Sun,Unauthorized: The Mary Kay Letourneau Story,Friends,The Hughleys,Auggie Rose,Straight Right,Next Friday,Godzilla 2000: Millennium,Two Guys, a Girl and a Pizza Place,Happily Ever After: Fairy Tales for Every Child,Mad About You,Twelfth Night, or What You Will,The Naked Truth,Pauly,Boston Common,Yellow,The Magic Pearl,Cowgirl,Spider-Man: The Animated Series,ABC Afterschool Specials,Buddies,Maybe This Time,The Puzzle Place,The Last Supper,Tokyo Bound,Seinfeld,All-American Girl,Nurses,Rising Sun,Singles,Hitz,Intimate Stranger,Baby Talk,Beverly Hills, 90210,Perfect Strangers,Ghost Dad,Circuitry Man,Scrooged,It's a Living,Night Court,The Big Blue,Growing Pains,The Real Ghostbusters,Living on Tokyo Time,Dim Sum: A Little Bit of Heart,Partners in Crime"
Mark McGrath,"The Masked Singer,Let's Be Real,2nd Chance for Christmas,The Last Sharknado: It's About Time,The Thundermans,Lady Dynamite,Sharknado 3: Oh Hell No!,Joe Dirt 2: Beautiful Loser,Workaholics,CollegeHumor Originals,Sharknado 2: The Second One,The Neighbors,Hot Package,The Office,FCU: Fact Checkers Unit,Master Debaters with Jay Mohr,Darker Side of Green,Law & Order: Special Victims Unit,Shania Twain Feat. Mark McGrath: Party for Two - Remix,Uptown Girls,Pauly Shore Is Dead,Scooby-Doo,Sugar Ray: When It's Over,The Drew Carey Show,Sugar Ray: Someday,Kid Rock: Only God Knows Why,Sugar Ray: Every Morning,Sugar Ray: Fly,Oddville, MTV,Fathers' Day"
Carrie Kemper,"Miracle Workers,Silicon Valley,Baskets,Nathan for You,About a Boy"
Elizabeth Payne,"The Last Tycoon,Aquarius,Always Watching: A Marble Hornets Story,Operation: Ice,Happy and You Know It,Murder in the First,Mr. Box Office,Vegas,The Co-Star,Scandal,The Office,Southland,Hart of Dixie,Law & Order: LA,The Steamroom,ER,Private Practice,Ugly Betty,Quid Pro Quo,Commander in Chief,Medium,The West Wing,Maya & Miguel,Boston Legal,Alias,Malcolm in the Middle,The Adventures of Tom Thumb & Thumbelina,Minority Report,Providence,Diagnosis Murder,Buffy the Vampire Slayer,Felicity,The Drew Carey Show,Nash Bridges"
Brandon Borror-Chappell,"The Office,Pitch Perfect"
Brian Gattas,"The Pitch,Skinny Jeans,Diary of a Future President,Under the Silver Lake,Bob's Burgers,Mistresses,Silicon Valley,Faking It,Aquarius,Looking,Silent Shadows,We Hate Paul Revere,Lizzie & Ali, a (Mostly) True Story,Effed!,Bros,Paragon School for Girls,Bakersfield, Earth,The Bling Ring,Trust Me,Lovelace,Community,The Office,Razzle Dazzle Part 2,Razzle Dazzle,Brothers & Sisters,Somewhere,Gaysharktank.com,Svetlana,Bailey's,Two Classy Ladies,Transatlantic,Turn Me on, Dead Man,Rex,Eleventh Hour,The More Things Change...,Kath & Kim,Get Smart's Bruce and Lloyd Out of Control,Dexter,Itty Bitty Titty Committee,Stick It,Available Men,Age of Kali,Lucky 13,Radiance,Arrested Development,Surviving Eden,Dead & Breakfast,Behind the Camera: The Unauthorized Story of 'Charlie's Angels',Comedy Central Laughs for Life Telethon 2003,High Voltage,Is This Your Mother?,Black of Life,Bubble Boy,Liquid,Sunset Strip,Will & Grace,Verses,Pirates of Silicon Valley,Jawbreaker,Delivered,Judas Kiss,Profiler,Coyote,Gunplay"
Dan Castellaneta,"Shelter in Solitude,The Simpsons,Balenciaga,The Good, the Bart, and the Loki,Conan,Family Guy,Merry Happy Whatever,Brockmire,Google Translate,Hey Arnold: The Jungle Movie,Planet of the Couches,Jimmy Kimmel Live!,The Unauthorized Melrose Place Story,The Unauthorized Beverly Hills, 90210 Story,Fantastic Four,Baby Daddy,Trumptastic Voyage,Late Show with David Letterman,Last Week Tonight with John Oliver,The League,The Simpsons Take the Bowl,Willie's Views on Scottish Independence,Quick Draw,Hot in Cleveland,Parks and Recreation,Continuing Fred,Major Crimes,Dads,Futurama,The Mindy Project,Wendell and Vinnie,The Office,The Simpsons: Tapped Out,Super 8,Greek,Castle,The Good Guys,State of the Union,Desperate Housewives,Bones,How I Met Your Mother,Relative Stranger,Ghost Whisperer,Disney TH!NK Fast,Remembering Phil,Reno 911!,Futurama: The Beast with a Billion Backs,The Simpsons Ride,Superhero Movie,The Batman,Monk,The Simpsons Game,Entourage,Sands of Oblivion,The Tonight Show with Jay Leno,The Simpsons Movie,Chasing Robert,Hellboy Animated: Iron Shoes,Kingdom Hearts II: Final Mix+,Making Pursuit: An Italian Take on the American Dream,Campus Ladies,Cartoon Network Racing,The Jeff Garlin Program,The Pursuit of Happyness,Legion of Super Heroes,Happy Feet,Casper's Scare School,Veronica Mars,Scooby-Doo! Pirates Ahoy!,Tom and Jerry in Shiver Me Whiskers,I Want Someone to Eat Cheese With,I-See-You.com,Kingdom Hearts II,Loonatics Unleashed,Arrested Development,My Life as a Teenage Robot,Jasmine's Enchanted Tales: Journey of a Princess,What's New, Scooby-Doo?,Stargate SG-1,The Simpsons' Christmas Message,As Told by Ginger,Complete Savages,Hey Arnold!,Adventures in Homeschooling,Behind the Camera: The Unauthorized Story of 'Charlie's Angels',Party Wagon,That '70s Show,Metal Arms: Glitch in the System,The Cat in the Hat,Frasier,Buttleman,Duck Dodgers,Justice League,The Adventures of Jimmy Neutron, Boy Genius,The Simpsons: Hit & Run,Lucky,The Pitts,Reba,Rugrats,The Simpsons: Backstage Pass,Kim Possible,The Simpsons: Skateboarding,Lloyd in Space,Hey Arnold! the Movie,Kingdom Hearts,Jackie Chan Adventures,Peter Pan 2: Return to Never Land,The Simpsons: Road Rage,Everybody Loves Raymond,The Simpsons: Wrestling,Batman Beyond,Recess: School's Out,Laughter on the 23rd Floor,Yes, Dear,Aladdin in Nasira's Revenge,Buzz Lightyear of Star Command,Joseph: King of Dreams,Rugrats in Paris,CyberWorld,Jasmine's Wish,Y2K: The Game,Olive, the Other Reindeer,Planescape: Torment,Nash Bridges,Simpsons Bowling,Johnny Bravo,Oh, Grow Up,Earthworm Jim,I Am Weasel,Cow and Chicken,The New Woody Woodpecker Show,The Settlement,Sesame Street,Hercules,Mad About You,Aladdin's Arabian Adventures: Creatures of Invention,Aladdin's Arabian Adventures: Fearless Friends,The Spooktacular New Adventures of Casper,The Brave Little Toaster Goes to Mars,ClayFighter: Sculptor's Cut,My Giant,Rhapsody in Bloom,Hey Arnold!: Urban Adventures,The Online Adventures of Ozzie the Elf,ClayFighter 63 1/3,101 Dalmatians: The Series,The Simpsons: Virtual Springfield,Nightmare Ned,Plump Fiction,The Brave Little Toaster to the Rescue,Duckman: Private Dick/Family Man,The Drew Carey Show,Cybill,Earthworm Jim,Space Jam,Toonstruck,Eek! The Cat,Quack Pack,The Simpsons: Cartoon Studio,The Pink Panther,Aladdin's Arabian Adventures: Team Genie,All Dogs Go to Heaven 2,NYPD Blue,Friends,The Twisted Tales of Felix the Cat,Snow White and the Magic Mirror: Interactive Storybook,The Mask,Aladdin,Aladdin's Arabian Adventures: Magic Makers,The Greatest Treasure,Forget Paris,Taz-Mania,Driving Mr. Pink,The Computer Wore Tennis Shoes,Turbocharged Thunderbirds,Murphy Brown,Daisy-Head Mayzie,Virtual Bart,Beethoven,The Tick,Aladdin Activity Center,Snow White and the Magic Mirror,Grace Under Fire,Love Affair,Bakersfield P.D.,The Client,Related by Birth,Hey Arnold!: 24 Hours to Live,The Return of Jafar,The George Carlin Show,Wings,Problem Child,The Critic,Marsupilami,Animaniacs,Sesame Street Jam: A Musical Celebration,Phenom,Sonic the Hedgehog,Tracey Takes on New York,Bobby's World,Super Mario Bros.,Sibs,Back to the Future,Darkwing Duck,Krusty's Super Fun House,Tiny Toon Adventures,Love & War,Fievel's American Tails,Married... with Children,Dinosaurs,L.A. Law,Goof Troop,Lady Against the Odds,Michael Jackson: Black or White,Dream On,Don't Tell Mom the Babysitter's Dead,TaleSpin,Big Bird's Birthday or Let Me Eat Cake,Sesame Street: Monster in the Mirror,The Simpsons,Bart Simpson: Do the Bartman,Working Tra$h,Bagdad Cafe,The Tracey Ullman Show,ALF,The Adventures of Dynamo Duck,The War of the Roses,K-9,The Simpsons: Family Therapy,Say Anything,The Simpsons: Tracey Ullman Shorts,The Simpsons: Family Portrait,Nothing in Common"
Tig Notaro,"Glitter & Doom,Your Place or Mine,Army of the Dead: Lost Vegas,Am I OK?,Other Plans,We Have a Ghost,Army of the Dead,Bob's Burgers,Together Together,Music,Star Trek: Discovery,Star Trek: Discovery Logs,The Fungies,Phoebe Bridgers: Garden Song,Transparent,Lucy in the Sky,Tuca & Bertie,UnMade,Instant Family,Dog Days,New Girl,Fresh Off the Boat,Transparent: The Lost Sessions,One Mississippi,Clarence,The Fun Company,The Jim Gaffigan Show,Lady Dynamite,Punching Henry,Adventure Time,Clown Service,Lisa,Rubberhead,Ashes,Comedy Bang! Bang!,Catch Hell,Garfunkel and Oates,Maron,Walk of Shame,Suburgatory,Inside Amy Schumer,In a World...,Susan 313,The Office,The Life & Times of Tim,Crying in Public,Community,Held Up,Lez Chat,The Sarah Silverman Program.,Back on Topps,In the Motherhood,Held Up,Dog Bites Man"
Melissa Bickerton,"A Concise Chinese English Dictionary for Lovers,Untitled Lakers Project,Starch,True Story,Side Hustle,Post Sentence,You Are My Home,Cherish the Day,Fresh Off the Boat,Foster Boy,Arrested Development,Shameless,Love,Playing It Straight,Snowfall,Stripped,The Laughing Man,Agents of S.H.I.E.L.D.,Code Black,The Last Ship,Any Day,Rizzoli & Isles,Fingered,The League,Barney,Sweet Somethings,Saving Mr. Banks,Medal of Honor: Warfighter,The Office,The Young and the Restless,Criminal Minds,The Event,Change Your Life!,Medium,Conviction,Seven Pounds,A Little Less Ordinary,Aces 'N' Eights,The Governor's Wife,Crash and Burn,Eragon,Lost,Without a Trace,Las Vegas,Maniac Magee,The Andy Dick Show,Baby Geniuses,The Ransom of Red Chief,Catherine's Grove,Stolen Memories: Secrets from the Rose Garden,Species,Poor Man's Orange,Willing and Abel,The Facts of Life Down Under,Sons and Daughters"
Jeff Bee,"The Dropout,River,D.P.,1 Night in San Diego,The Purge,The Illegal,The Loser Anthem,Game,Super Viral Studios,NCIS: Los Angeles,Hopeless, Romantic,You & Me/Me & You,Booze Lightyear,Exit 13,Courting Chaos,Everyday Lies,After the Bee,The Office,Greener,This Indie Thing,Help!,The Potstickers"
Dee Wallace,"Catch a Fallen Star,Final Cut,The Pitch-Fork,CAMPFIRE,Bits,Nix,Stream,The Nest,9-1-1,The Gift of Christmas,Stay Home,Await the Dawn,Forever Love,Christmas in Louisiana,3 from Hell,Renovation of the Heart/It's a Fixer Upper,After Emma,The Wrong Mommy,Critters Attack!,Dolls,Sunrise in Heaven,Elixir,Just Add Magic,The Wrong Teacher,Every Other Holiday,Jingle Belle,NCIS,Beyond the Sky,Shooter,Ouija House,Closure,This Old Machine,Lifeline,Ayla,Country Road 12,You're the Worst,Death House,The Fuzz,Charlie's Gift,All Hallows' Eve,This Moment,Red Christmas,Supernatural,Polaroid,Flowers in December,The Whispers,General Hospital,ZK: Elephant's Graveyard,Between the Sand and the Sky,Love & Mercy,2 Bedroom 1 Bath,Peter's Ashes,Ejecta,Cry of the Butterfly,Haunting of Cellblock 11,The Jazz Funeral,Grimm,Lucky Charm,Bonnie & Clyde: Justified,My Stepbrother Is a Vampire!?!,Grand Piano,Robocroc,A Hollywood Affair,Hansel & Gretel,In Session with Jonathan Pessin,Aliens from Uranus,As High as the Sky,Switched at Birth,The Lords of Salem,Warehouse 13,Troubled Child,Fuzz Track City,Margarine Wars,Collision Course,Sebastian,Sam Steele and the Crystal Chalice,The Office,Exit Humanity,Walk a Mile in My Pradas,Exodus Fall,Killing Ruth: The Snuff Dialogues,Bad Actress,Beautysleep Symphony,Soupernatural,Detroit 1-8-7,Between Heaven and Hell,Law & Order: LA,Pound of Flesh,Bedrooms,Raven,Happy Town,Cage Free,Extraordinary Measures,The Guardian,Happy in the Valley,The Stalker Within,Babysitters Beware,Dark Fields,The Haunted World of El Superbeasto,The Magic 7,The Mother of Invention,The House of the Devil,Stay Cool,Stem Cell,Little Red Devil,Criminal Minds,Matchmaker Mary,Saving Grace,Ghost Whisperer,My Name Is Earl,The Blue Rose,Halloween,Bone Dry,Grey's Anatomy,J-ok'el,Sons & Daughters,Close to Home,Without a Trace,The Plague,The Eden Formula,Voodoo Moon,Bones,Expiration Date,Abominable,Kalamazoo?,American Blend,The Lost,Yesterday's Dreams,Crossing Jordan,Headspace,Boo,Scar,The Loch Ness Monster,Cold Case,Dead End Road,Illusion Infinity,The Perfect Husband: The Laci Peterson Story,Dead Canaries,The Agency,Sex and the Teenage Mind,She Spies,Fish Don't Blink,The Division,She's No Angel,Adjustments,Felicity,A Month of Sundays,Killer Instinct,Out of the Black,Flamingo Dreams,Big Wind on Campus,Deadly Delusions,Pirates of the Plain,Ally McBeal,Invisible Mom II,To Love, Honor & Betray,Nash Bridges,The Christmas Path,Invasion America,Bad As I Wanna Be: The Dennis Rodman Story,Mutual Needs,Touched by an Angel,Nevada,Skeletons,The Perfect Mother,Love's Deadly Triangle: The Texas Cadet Murder,JAG,Black Circle Boys,The Frighteners,Subliminal Seduction,Invisible Mom,Cops n Roberts,The Phoenix and the Magic Carpet,Brothers' Destiny,High Sierra Search and Rescue,Temptress,Best of the Best 3: No Turning Back,Vanishing Son IV,Rebel Highway,Discretion Assured,The Skateboard Kid 2,Moment of Truth: Cradle of Conspiracy,Search and Rescue,Witness to the Execution,Huck and the King of Hearts,Alone in the Dark,My Family Treasure,Prophet of Evil: The Ervil LeBaron Story,Lightning in a Bottle,FBI: The Untold Stories,L.A. Law,Rescue Me,The New Lassie,P.S.I. Luv U,Rock-A-Doodle,Alligator II: The Mutation,Murder, She Wrote,Popcorn,I'm Dangerous Tonight,Addicted to His Love,Stranger on My Land,Nothing Is Easy,Bushfire Moon,Hotel,CBS Schoolbreak Special,Legend of the White Horse,Shadow Play,Critters,Sin of Innocence,Club Life,Hostage Flight,The Twilight Zone,Simon & Simon,Suburban Beat,Secret Admirer,Finder of Lost Loves,The Shepherd,100 Centre Street,The Sky's No Limit,Happy,Cujo,Wait Till Your Mother Gets Home!,I Take These Men,Skeezer,Jimmy the Kid,CBS Afternoon Playhouse,E.T. the Extra-Terrestrial,Child Bride of Short Creek,The Five of Me,ABC Afterschool Specials,A Whale for the Killing,The Howling,The Secret War of Jackie's Girls,Here's Boomer,Skag,Taxi,Young Love, First Love,Mrs. Columbo,CHiPs,Trapper John, M.D.,Hart to Hart,10,Lou Grant,Police Story,Barnaby Jones,All the King's Horses,The Krofft Supershow,Police Woman,Starsky and Hutch,Bigfoot and Wildboy,The San Pedro Beach Bums,Man from Atlantis,The Hills Have Eyes,Ellery Queen,The Stepford Wives,The Streets of San Francisco,Lucas Tanner"
Casey Washington,"Quara6tine,Cooper's Bar,Henry Danger,The Great Indoors,The Soul Man,Mike & Molly,Young & Hungry,The Odd Couple,The Empty Morning,Hot in Cleveland,Phone Rehab,Key and Peele,How I Met Your Mother,The Finder,The Office,Immoderate Generation,Nose Candy,Gangs of LA 1991,Brothers,My Brother's Keeper,Cold Case,Frank TV,Everybody Hates Chris,Heroes,The Shield,Close to Home,All of Us,Justice"
Seamus McCarthy,"Unaffiliated,We Hate Paul Revere,Jimmy Kimmel Live!,State of Georgia,The Office,My Boys"
Nancy Lantis,"Baselines,Sweet Tea,Superstore,Stage Managed,Finding Love in Quarantine,Space Force,68 Whiskey,Curb Your Enthusiasm,Viral,Pre Mortem,Brooklyn Nine-Nine,Half Off Heroes,Booster Mom,Rachel's Pitch,Veep,Grace and Frankie,Love,Godsdotcom,Hello Ladies,Arrested Development,New Girl,48 Roses: Mariachi El Bronx,The Office,Ninjas in the Shed,Ijé: The Journey,Quick, Fast, and in a Hurry,Kidnappeando,Family Jewels,Parks and Recreation,Is This Seat Taken,Rosewood Avenue,Welcome Freshmen"
Bill Coelius,"Halston,American Experience,The Marvelous Mrs. Maisel,Brave New Jersey,American Horror Story,Criminal Minds,Deadline: The Nikki Finke Story,Sides & Rides,Newsreaders,Modern Family,Parks and Recreation,Desperate Housewives,The Office,An Invisible Sign,The Face,Taking Woodstock,Quality Time,Door Number Two,Law & Order,Living with Strangers,Robot Stories,Scarlett Mecca and the Pentagram Girl"
Janet Hoskins,"I Think You Should Leave with Tim Robinson,Moonbase 8,Sunnyside,The Cool Kids,Teachers,Bosch,Buckshot,Girlboss,Feud: Bette and Joan,Joy,Walk the Prank,Adam Ruins Everything,New Girl,Getting On,Spirit Town,Mixology,Whiplash,Castle,It's Always Sunny in Philadelphia,1600 Penn,Justified,Law & Order: LA,The Office,Dark Blue,Emilio,Jericho,I Stand Here Ironing,The Comeback,Close Call,Little Ricky,Sunflowers"
Barak Hardley,"The Movie Show,Vampire Dad,The Mortuary Collection,Betch,The Goldbergs,Spell,Dell: Tales of Transformation,Pumpkin,That Moment When,A Midsummer Night's Dream,Pitch Off with Doug Benson,Master of None,Screen Junkies Roasts,Dennis,Office Assassins,Craft Services,Halt and Catch Fire,Tween Fest,Junketeers,CC: Social Scene,Road to the Well,Lopez,Show Yourself,Togetherness,The UCB Show,Interns of F.I.E.L.D.,Filthy Preppy Teen$,Pitiful Creatures,Dr. Ken,Disconnected,The Babysitter Murders,What Lives Inside,Divine Access,Shameless,Adult Wednesday,Mulaney,The Bronze,Life Coach,The Nobodies,A Merry Friggin' Christmas,Mockingbird,Jump!,CollegeHumor Originals,Patton Oswalt Confronts His Haters,Coffee Shop Squatters,Review,Community,Shark Bites,Raising Hope,Sketchy,The Big Bang Theory,Evidence,iSteve,Bounty Killer,Ben and Kate,Game Shop,The Book Club,The Kitchen,Paulilu Mixtape,The Elephant in the Room,Blue Like Jazz,Just a Tip,Hot in Cleveland,Kent Newton and the Surrogate Rebuttal,Los Angeles 10101,The Unauthorized Documentary, Hangover Part II,The Office,Free Agents,Dog DNA,Men Are Dogs,Summer of the Zombies,Blind on Blind,Falling Overnight,Bounty Killer,Bus Stop,Parts + Labor,Red Dead Redemption,Blowout Sale,LA I.C.E,The Last Lovecraft: Relic of Cthulhu,Greek,Head Case,Crash Course with Shaun White"
Jim Carrey,"Sonic the Hedgehog 2,Saturday Night Live,Kidding,Sonic the Hedgehog,Dark Crimes,The Bad Batch,Dumb and Dumber to,Kids,Anchorman 2: The Legend Continues,Kick-Ass 2,Cold Dead Hand with Jim Carrey,The Incredible Burt Wonderstone,30 Rock,Drunk History Christmas,Drunk History,Mr. Popper's Penguins,The Office,Behind the Carol: The Full Motion-Capture Experience,Presidential Reunion,A Christmas Carol,I Love You Phillip Morris,Yes Man,Horton Hears a Who!,The Number 23,Fun with Dick and Jane,A Series of Unfortunate Events,A Series of Unfortunate Events,Eternal Sunshine of the Spotless Mind,Pecan Pie,The Work of Director Michel Gondry,Bruce Almighty,The Majestic,How the Grinch Stole Christmas,Me, Myself & Irene,Man on the Moon,The Truman Show: Tru-Talk,Simon Birch,The Truman Show,The Larry Sanders Show,Liar Liar,Jerry Cantrell: Leave Me Alone,The Cable Guy,Ace Ventura: When Nature Calls,Batman Forever,Jim Carrey: Cuban Pete,Dumb and Dumber,The Mask,In Living Color,Ace Ventura: Pet Detective,The Itsy Bitsy Spider,Doing Time on Maple Drive,High Strung,Pink Cadillac,Mike Hammer: Murder Takes All,Earth Girls Are Easy,The Dead Pool,Peggy Sue Got Married,Once Bitten,The Duck Factory,Finders Keepers,Buffalo Bill,The Sex and Violence Family Hour,Copper Mountain,All in Good Taste,Rubberface"
David Mate,"General Hospital,NCIS: Los Angeles,The Office,Fiasco,Gamer,Criminal Minds,Come Clean,Nip/Tuck,Late Fragment,Ghostly Encounters"
Sean Davis,"Chicago P.D.,Dead Girl,#Nausea... for Millennials,Bad Girls,CSI: NY,The Office,The Middleman,Cold Case,Medium,Smith"
Frank Birney,"Jesus,Harriet: The Musical,Kidding,The Ride,Arrested Development,Fresh Off the Boat,Room 104,Animal Kingdom,The Mick,Great News,Grimm,Scream Queens,Life in Pieces,Angie Tribeca,Here's to Being Brave,Hidden America with Jonah Ray,Silicon Valley,F#@K I Love U,New Girl,Ticketed,Rumination,The Heyday of the Insensitive Bastards,Franklin & Bash,Key and Peele,Mother Fakers,You & I, My Dear,Big Gus,This Is How You Die,The Eric Andre Show,The Haunted Hathaways,Mr. Box Office,Clued-Less,Hart of Dixie,Rizzoli & Isles,Other People,Puppet Master,Eagleheart,Matchmakers,Acting Out,The Office,Castle,Wicked Lake,Boston Legal,The Practice,The Guardian,Power Play,Six Feet Under,Roswell,City of Angels,Providence,7th Heaven,Charmed,The Christmas Wish,Inferno,Mafia!,Profiler,Public Morals,Norma Jean & Marilyn,Yesterday's Target,Mad About You,ABC Afterschool Specials,Diagnosis Murder,Reflections on a Crime,Trouble Shooters: Trapped Beneath the Earth,Swat Kats: The Radical Squadron,Dave,Almost Home,The Opposite Sex and How to Live with Them,Jennifer 8,Rachel Gunn, R.N.,The Heroes of Desert Storm,Don't Touch My Daughter,Ferris Bueller,Angel of Death,Generations,L.A. Law,Shannon's Deal,Freddy's Nightmares,C.H.U.D. II: Bud the Chud,Perfect Strangers,Simon & Simon,Lucky Stiff,Critters 2,The Betty Ford Story,The Golden Girls,Knots Landing,Mr. and Mrs. Ryan,Hill Street Blues,Bad Guys,Highway to Heaven,Night Court,George Burns Comedy Week,Three's a Crowd,Otherworld,Cover Up,Dreams,The Dukes of Hazzard,The Jerk, Too,Knight Rider,Jennifer Slept Here,AfterMASH,Mr. Mom,Quincy M.E.,The Discipline of D.E.,Crisis Counselor,Dallas,Pray TV,Fantasy Island,Modern Problems,Return of the Rebels,Code Red,Miracle on Ice,Bosom Buddies,Fear No Evil,Child's Play,The Babysitter,Portrait of an Escort,Portrait of a Stripper,The Clonus Horror,Corey: For the People"
Evan Peters,"Snow Ponies,Monster: The Jeffrey Dahmer Story,American Horror Story,Mare of Easttown,WandaVision,I Am Woman,X-Men: Dark Phoenix,Pose,Deadpool 2,American Animals,The Accomplice,The Pirates of Somalia,X-Men: Apocalypse,Elvis & Nixon,China, IL,Safelight,The Lazarus Effect,X-Men: Days of Future Past,Sofia Coppola's the Little Mermaid,Adult World,Queen,In Plain Sight,The Good Doctor,Never Back Down 2: The Beatdown,Parenthood,The Office,Myself and I,The Mentalist,Kick-Ass,Criminal Minds,Ghost Whisperer,Off the Clock,One Tree Hill,House,Monk,Without a Trace,Dirt,Never Back Down,Gardens of the Night,Remarkable Power,Mama's Boy,An American Crime,Invasion,Phil of the Future,The Days,Sleepover,Clipping Adam"
Eugene Cordero,"Scroll Wheel of Time,Easter Sunday,Tacoma FD,Star Trek: Lower Decks,10-Year-Old Tom,Central Park,Loki,No Activity,Close Enough,Golden Arm,Loafy,The High Note,Bob's Burgers,Carol's Second Act,The Good Place,The Patients,The Mandalorian,Helpsters,Bajillion Dollar Propertie$,Star vs. the Forces of Evil,Troopers,Those Who Can't,I'm Sorry,Weird City,Black Monday,Dream Corp LLC,The Mule,Wrecked,Strange Angel,Door No. 1,Archer,Steven Universe,Grace and Frankie,Do You Want to See a Dead Body?,Aswang Next Door,Crazy Ex-Girlfriend,Veep,Brooklyn Nine-Nine,Making History,The Legend of Master Legend,Kong: Skull Island,Nightmare Time,The Earliest Show,Son of Zorn,Ghostbusters,Mike and Dave Need Wedding Dates,Teachers,The UCB Show,Sounds We Have No Letters for,Everybody Does It,Steven Universe: Unboxing,Rooster Teeth: Entertainment System Originals,The Hotwives of Las Vegas,Comedy Bang! Bang!,Other Space,Kroll Show,Parks and Recreation,Key and Peele,Munchie the Doughnut,Garfunkel and Oates,Drunk History,Playing House,Silicon Valley,Hawaii Five-0,House of Lies,Our RoboCop Remake,If You See Something,CollegeHumor Originals,Funny or Die Presents...,NFL Training Video: How Not to Murder People,The State of Us,Arrested Development,Kirstin Lives in Los Angeles,Maron in Space,Genie on Hard Times with Parker Posey,Newsreaders,Manti Te'o's Catfish Trailer,Manti Te'o's EHarmony Ad,Afternoon Delight,The Kings of Summer,UCB Comedy Originals,Up All Night,Happy Endings,Mash Up,Sketchy,A Taste of Magic,Improv Everywhere Originals,Behind the Binary: AllThingsD,The Life & Times of Tim,Coffee Snobs,The Back Room,Dog DNA,Bachelorette Ashley Is Single Again,Curb Your Enthusiasm,The World's Worst Bodyguard,Worst. Prom. Ever.,Mash Up,The Office,Cordero, Bathtub and Wolf,NYC Mosque Commercial,Michael Vartan Has Dorfism,Furry Vengeance,The Indigenous Flowers of Southern California,When in Rome,Jon and Car Plus Blanket,UCB TourCo,Late Night with Jimmy Fallon,Terrible Decisions with Ben Schwartz,Bronx World Travelers,Human Giant,Fucked,The UCBW,My Wife, the Ghost,The Adventures of Elton Bridge,Upright Citizens Brigade,Cage Match"
