actor,movie_or_TV_name
Charlotte Stewart,"Livin' On a Prairie,Twin Peaks,Twin Peaks: The Missing Pieces,Where's My Sandwich?,Mayfly,The Inner Circle,The Office,Cold Case,Tremors 3: Back to Perfection,Puppy Love,Desert Son,Slums of Beverly Hills,The Rockford Files: Friends and Foul Play,Beverly Hills, 90210,A Whole New Ballgame,Dark Angel: The Ascent,Life Goes on,Twin Peaks: Fire Walk with Me,Coach,Twin Peaks,Thirtysomething,Tremors,Journey to the Center of the Earth,Warm Hearts, Cold Feet,Matlock,The Young and the Restless,Highway to Heaven,Irreconcilable Differences,UFOria,Human Highway,Buddy Buddy,The Princess and the Cabbie,Eight Is Enough,Bitter Harvest,Mother, Juggs & Speed,Little House on the Prairie,Murder in Peyton Place,Eraserhead,Secrets,Barnaby Jones,The Texas Wheelers,The Nurse Killer,The Impostor,This Is the Life,Firehouse,Gunsmoke,Cannon,Medical Center,McMillan & Wife,The F.B.I.,The Waltons,Cade's County,Mannix,Bonanza,The Interns,The Young Lawyers,The Cheyenne Social Club,The Virginian,The Girl with the Hungry Eyes,Then Came Bronson,Hawaii Five-O,Speedway,Doctor, You've Got to Be Kidding!,The Slender Thread,12 O'Clock High,My Three Sons,Summer of '63,Stoney Burke,Bachelor Father,V.D.,Margie,The Loretta Young Show"
Landon H. Lewis Jr.,"Murder 101,The Office,ER"
Emerson Brooks,"Scalebound,Queens,Spider-Man: Miles Morales,Deep Blue Sea 3,Disintegration,MacGyver,The Orville,Arrested Development,The Last Ship,Call of Duty: Infinite Warfare,The Goldbergs,Change of Heart,NCIS: Los Angeles,Call of Duty: Black Ops III,Devil's Third,The Comedians,Far Cry 4,American Sniper,Call of Duty: Advanced Warfare,Come Together,The Amazing Spider-Man 2,inFamous: Second Son,Captain America: The Winter Soldier,Star-Crossed,Grand Theft Auto V,Saints Row IV,Marvel Heroes,Army of Two: The Devil's Cartel,Halo 4,World of Warcraft: Mists of Pandaria,Saints Row: The Third,Call of Duty: Modern Warfare 3,Skylanders: Spyro's Adventure,All My Children,Super 8,Red Faction: Armageddon,Water for Elephants,Call of Duty: Black Ops,Fallout: New Vegas,The Closer,Justified,Prison Break: The Conspiracy,Medium,The Forgotten,Avatar: The Game,Flashforward,Marvel: Ultimate Alliance 2,Brüno,Terminator Salvation,24,Lost,Lie to Me,The Least Among You,Resistance 2,Numb3rs,Escape from Darwin,ER,The Office,The Hanging Tree,Monk,Las Vegas,Homo Erectus,National Treasure: Book of Secrets,Journeyman,Heroes,NCIS,Life,Dream Slashers,The Unit,Vanished,Cuts,Forensic Files"
Terrence Beasor,"Kidding,The Middle,Hustle,The Fake News with Ted Nelms,Winning Ugly,Angie Tribeca,Is That a Gun in Your Pocket?,The Grinder,Documentary Now!,Scandal,I Didn't Do It,Raising Hope,A Perfect Ending,House,Fully Loaded,Hot in Cleveland,Parks and Recreation,How Do You Know,The Office,Strange Wilderness,Walk Hard: The Dewey Cox Story,The Shadow Effect,Demon Hunter,McBride: The Chameleon Murder,Scrubs,Gilmore Girls,Homeland Security,The Commission,The Brotherhood of Poland, New Hampshire,Star Trek: Elite Force II,The District,Star Trek: Starfleet Command III,The Warriors of the 14th Fairway,The Practice,Star Trek: Armada II,Rockets' Red Glare,Angel,Star Trek Voyager: Elite Force,Passions,Star Trek: Invasion,Dash and Lilly,Too Rich: The Secret Life of Doris Duke,Winchell,Star Trek: Voyager,Suddenly Susan,George Wallace,Chicago Hope,Hearts Afire,Sweet Justice,The Burning Season: The Chico Mendes Story,Forever Young,Star Trek: The Next Generation,Homefront,Reasonable Doubts,Columbo,Father Dowling Mysteries,Knots Landing,Days of Our Lives,Solar Crisis,Coupe de Ville,Miracle Landing,The Phantom of the Opera,Murder, She Wrote,Time Trackers,Flying Blind,Everybody's All-American,Miles from Home,Simon & Simon,Dynasty,The Law and Harry McGraw,Frank's Place,Karen's Song,Jaws: The Revenge,The Return of the Six-Million-Dollar Man and the Bionic Woman,Max Headroom,Spies,L.A. Law,Monster in the Closet,Cheers,Remington Steele,Crazy Like a Fox,Hill Street Blues,Hunter,The Return of the Living Dead,Hardcastle and McCormick,Tuff Turf,Walking the Edge,Runaway,George Washington,The A-Team,Dallas,The Greatest American Hero,The Powers of Matthew Star,White Dog,A Woman Called Golda,Police Squad!,Today's F.B.I.,The Gangster Chronicles,Pennies from Heaven,House Calls,Jessica Novak,The Young and the Restless,Please Don't Hit Me, Mom,Palmerstown, U.S.A.,The Incredible Hulk,Paris,Salvage 1"
Nathan Blank,"The Office,Jaded,The Good Humor Man"
Nick Armstrong,"Donny's Bar Mitzvah,Site Unseen,Young Sheldon,Wild Bunch on Ice,Valentino and the Prodigy,The Hug,Brooklyn Nine-Nine,Stan Against Evil,The Bigfoot Project,Cooper Barrett's Guide to Surviving Life,Drunk Break Up,Walk of No Shame,Meryl: The Lifetime Biopic with Christina Applegate,Key and Peele,Red Shirts,Hot in Cleveland,New Girl,First Sh*T,Raising Hope,Consequences,Parks and Recreation,Grey's Anatomy,Jimmy Kimmel Live!,iCarly,1000 Ways to Die,Team A.P.O.C.A.L.Y.P.S.E.,The Office,Sell This Bike!"
Justin Meloni,"I See You,Camp Sunshine,Free Love,Workshop,Un-Broke: What You Need to Know About Money,Flicka (Not the Horse),Parthenabe,CSI: NY,Meta,Shamelove,The Office,Campaign Manager,Between the Lines,FAQs,Cold Case"
Bob Harrell,The Office
Jim Jansen,"Gilmore Girls: A Year in the Life,Murder in the First,Mom,Mike & Molly,Revenge,Wilfred,The Mentalist,Harry's Law,Parks and Recreation,Water for Elephants,Men of a Certain Age,Law & Order: LA,Mad Men,Make It or Break It,Nip/Tuck,Terminator: The Sarah Connor Chronicles,Mr. Wrinkles,Boston Legal,Raising the Bar,Brothers & Sisters,Charlie Wilson's War,Cold Case,Cane,How I Met Your Mother,Tell Me You Love Me,Veronica Mars,The Office,Eyes,Christmas Do-Over,Desperate Housewives,Shark,Bones,Gilmore Girls,The Suite Life of Zack & Cody,Las Vegas,In Justice,Crumbs,The Reading Room,The Bernie Mac Show,Malcolm in the Middle,NYPD Blue,Days of Our Lives,The Practice,Miracles,Skin,Monk,Return to the Batcave: The Misadventures of Adam and Burt,Yes, Dear,Mister Sterling,Andy Richter Controls the Universe,For the People,The Division,Murder by Numbers,The West Wing,That '80s Show,Nikki,Surviving Gilligan's Island: The Incredibly True Story of the Longest Three Hour Tour in History,A.I. Artificial Intelligence,That's My Bush!,Charmed,The District,Bette,Felicity,The Steve Harvey Show,The Last Dance,ER,Bull,Any Day Now,Miracle in Lane 2,Ally McBeal,Star Trek: Armada,Chicago Hope,Diagnosis Murder,3rd Rock from the Sun,Cab to Canada,Melrose Place,Something So Right,The X-Files,Step by Step,C-16: FBI,Saved by the Bell: The New Class,Smart Guy,Hangin' with Mr. Cooper,'Til There Was You,Liar Liar,Ink,Star Trek: Deep Space Nine,Lois & Clark: The New Adventures of Superman,Home Improvement,Weird Science,The Fresh Prince of Bel-Air,The Birdcage,Picket Fences,Boy Meets World,Kirk,Double Rush,Blue Skies,Murphy Brown,Love & War,Dave's World,Airborne,Matlock,Death Becomes Her,Parker Lewis Can't Lose,Coach,Eerie, Indiana,Pyrates,Jake and the Fatman,Growing Pains,They Came from Outer Space,Just the Ten of Us,L.A. Law,Hooperman,Almost Grown,She Knows Too Much,The Boost,Newhart,Dennis the Menace,Mr. Belvedere,Who's the Boss?,Easy Street,Amazing Stories,Benson,Highway to Heaven,Best Defense,Remington Steele,AfterMASH,Alice,Special Bulletin,Tootsie,So Fine,The Doctors,Charlie's Angels,How to Succeed in Business Without Really Trying"
Matt Price,"Close Enough,Apple & Onion,Regular Show,Regular Show: The Movie,The Jeff Dunham Show,Atom TV,Max 1, 000 Words,Root of All Evil,Cheap Seats: Without Ron Parker,The Tom Green Show"
Andrew Daly,"Home Sweet Home Alone,Inside Job,Big City Greens,Operation Cordelia,American Dad!,Central Park,Conan,Adventure Time: Distant Lands,The Space Between,Solar Opposites,The Great North,Black-ish,Bob's Burgers,Harley Quinn,Thanks Nurses,Reno 911!,Big Mouth,Liza on Demand,Mao Mao: Heroes of Pure Heart,Veep,Special,The Big Bang Theory,Modern Family,The Shivering Truth,The Good Place,Trial & Error,Big Hero 6: The Series,Future-Worm!,The Who Was? Show,Silicon Valley,The Simpsons,Adventure Time,Teachers,You're the Worst,Dice,Brooklyn Nine-Nine,Review,Table 19,Drive Share,Chunk & Bean,Bad Guys,Your Pretty Face Is Going to Hell,Comedy Bang! Bang!,Mary + Jane,FML,Middle School: The Worst Years of My Life,Zoolander: Super Model,Another Period,Lady Dynamite,Bajillion Dollar Propertie$,The UCB Show,Grandfathered,Wander Over Yonder,Crash Test: With Rob Huebel and Paul Scheer,Rick and Morty,Aqua Teen Hunger Force,The Spoils Before Dying,A Better You,Mr. Pickles,The League,Jason Nash Is Married,Major Crimes,Bad Teacher,Playing House,Real Estate - Crime,Kroll Show,Enlisted,Drunk History,Dark Minions,A Haunted House,Sketchy,Regular Show,Eastbound & Down,Are You There, Chelsea?,Delocated,The Life & Times of Tim,Last Man Standing,Big Miracle,The Paul Reiser Show,Good Vibes,Butter,Transformers: Dark of the Moon,High Road,The Back Room,Yogi Bear,Jason Nash Is Married,This Show Will Get You High,Life as We Know It,Players,Freak Dance,Comedy Bang Bang: The Podcast,She's Out of My League,UCB Comedy Originals,Greek,The Informant!,Post Grad,The Closer,Tenure,What Happens in Vegas,Semi-Pro,American Body Shop,Trendsetters,Wild Girls Gone,Entourage,What Love Is,The Office,Dante's Inferno,School for Scoundrels,Blogland,Drake & Josh,Joint Custody,Christmas with the Kranks,Crossballs: The Debate Show,MADtv,TV Funhouse,Saturday Night Live,Hete Roy,The Whitey Show,Upright Citizens Brigade,Late Night with Conan O'Brien,The Swarm,Late Night with Conan O'Brien: 5,Cage Match,The Brave Little Toaster to the Rescue,Spin City"
John Ingle,"General Hospital,Mean Parents Suck,Timer,Parks and Recreation,Life in General,The Land Before Time,The Land Before Time XIII: The Wisdom of Friends,The Office,Social Security Guard,The Land Before Time XII: The Great Day of the Flyers,Big Love,Days of Our Lives,Second Thoughts,McBride: The Doctor Is Out... Really Out,Hostage,The Land Before Time XI: Invasion of the Tinysauruses,The Land Before Time X: The Great Longneck Migration,The Land Before Time IX: Journey to Big Water,The Drew Carey Show,The Land Before Time VIII: The Big Freeze,The Song of the Lark,Port Charles,The Land Before Time VII: The Stone of Cold Fire,Boy Meets World,Storm,The Land Before Time VI: The Secret of Saurus Rock,Senseless,The Land Before Time V: The Mysterious Island,Extreme Ghostbusters,Batman & Robin,Guide to the World of Family Computers, Software & Games,The Land Before Time IV: Journey Through the Mists,The Land Before Time III: The Time of the Great Giving,The Land Before Time II: The Great Valley Adventure,Melrose Place,King B: A Life in the Movies,Bonanza: The Return,Skeeter,Animaniacs,Suture,Life Goes on,Nightmare in the Daylight,Doogie Howser, M.D.,Likely Suspects,Death Becomes Her,Stepfather 3,The Human Factor,Beverly Hills, 90210,Tequila and Bonetti,Reasonable Doubts,Dear John,For Parents Only,For the Very First Time,Knots Landing,Davis Rules,Night Court,Lenny,Married People,Amen,Thirtysomething,Repossessed,RoboCop 2,Major Dad,Blind Faith,Jury Duty; The Comedy,Coach,The Neon Empire,Cast the First Stone,The Golden Girls,ALF,Day by Day,Great Performances,Heathers,Defense Play,The Days and Nights of Molly Dodd,14 Going on 30,The Facts of Life,Women in Prison,Mama's Family,I Married Dora,The Smurfs,Amazon Women on the Moon,Brothers,Throb,What a Country,Fame,The Magical World of Disney,Family Ties,One Big Family,True Stories,You Again?,Beverly Hills Madam,Acceptable Risks,Gimme a Break!,Paw Paws,Cheers,The Paper Chase,Stitches,Highway to Heaven,Silver Spoons,Webster,Newhart,Who's the Boss?,Scarecrow and Mrs. King,Dallas"
Haley Daniels,The Office
Nikki McCauley,"NCIS,Solve: The Podcast,Lief,Pod Broads,All Rise,The Kids Are Alright,NCIS: Los Angeles,Holly Goes to Therapy,Battle Fields,First Love,Better Things,New Mommies,The Last Word,I Know Jake Gyllenhaal Is Going to Fuck My Girlfriend,Unbeaten Path,Fall Into Me,Maron,The Kill Corporation,Side Effects of Barry,Resurrection Slope,Georgia,1. e4,Busting Out,American Warships,The Stazzi Studio,Happy Endings,Father vs. Son,'Til Death,Kissing Cousins,Veronica Mars,Ghost Whisperer,The Singles Table,Yellow Hammer,Karla,The Office,Love, Inc.,The Price of Freedom,Food for Thought"
Thomas F. Evans,"Lowercase i,Dreaming Hollywood,Fade Out Ray,The Quarantine Bunch,Euphoria,The Kids Are Alright,Urine Trouble,The Petal Pushers,Surviving Theater 9,Father's Day Breakfast,The Life and Death of Julian Finn,Gibby,General Hospital,Shovel Buddies,Hunky Dory,True Nightmares,Borderline,The Sac Fly,My Haunted House,Felly,Institutions,The Comeback Kids,Tarot: A Documentary Love Story,The Thundermans,Teacher's Lounge,OMG! EMT!,Review,Wheels,Perception,Criminal Minds,The Advocates,Tao of Simon,Jesus Is Back (and He Is Not Happy),The Adventures of Lewis & Clark,Sonny,After Lately,Not the Profile,MidRange,Atheists Anonymous,The Eric Andre Show,Days of Our Lives,The Young and the Restless,Shameless,Papa Zeus,No Strings Attached,Evan and Gareth Save the World,Stage 4,Q for Death,K-Town,Stay Shy,Torn,Worth,Horseman, Pass by!,Moonrock & Lighter Fluid,Tim and Eric Awesome Show, Great Job!,Flotsam,Meet Dave,The Brass Teapot,The Kopper Kettle,The Erogenous Zone,Last Comic Standing,Take,The Office,Yasin,My Name Is Earl,The Showbiz Show with David Spade,Gilmore Girls,Early Edition,Hoodlum,Michael,EZ Streets,Chain Reaction,Rookie of the Year,Dennis the Menace,Hoffa"
Annabelle Kopack,The Office
Beau Wirick,"Not Here,The Middle,We're Not Friends,American Crime Story,Gringo and Blondie,NCIS,The Walking Tedd,Act One,Greek,Christopher Brennan Saves the World,Drake & Josh,The Office,Arrested Development,Jack & Bobby,7th Heaven,The Bernie Mac Show,Raising Dad,Judging Amy"
Ed Lauter,"Becker's Farm,The Beautiful Ones,Blind Pass,The Town That Dreaded Sundown,Shameless,The Office,Trouble with the Curve,The Fitzgerald Family Christmas,Carnal Innocence,The Artist,Taken by Force,Psych,The Prometheus Project,Godspeed,Expecting a Miracle,The American Standards,Grey's Anatomy,Chocolate News,Cold Case,Operation Shock and Awe... some,Something's Wrong in Kansas,Camille,The Prince and the Pauper: The Movie,The Number 23,Seraphim Falls,Talladega Nights: The Ballad of Ricky Bobby,Love Hollywood Style,The Lost,Solace,Purple Heart,Venice Underground,Into the Fire,Brothers in Arms,The Longest Yard,NYPD Blue,JAG,Art Heist,Starship Troopers 2: Hero of the Federation,Grandpa's Place,The Librarians,Nobody Knows Anything!,Seabiscuit,Kingpin,Go for Broke,CSI: Crime Scene Investigation,ER,Not Another Teen Movie,Knight Club,Charmed,Thirteen Days,Python,Civility,Gentleman B.,Blast,Law & Order,Farewell, My Love,Night of Terror,Out in Fifty,The Magnificent Seven,Dollar for the Dead,A Bright Shining Lie,Millennium,Walker, Texas Ranger,Allie & Me,Under Wraps,Married to a Stranger,Top of the World,Childhood Sweetheart?,Coyote Summer,Mercenary,For Which He Stands,Raven Hawk,Mulholland Falls,Rattled,Kung Fu: The Legend Continues,The Sweeper,Can't Hurry Love,Ripple,Crash,Working for Harry,Leaving Las Vegas,Digital Man,The Tuskegee Airmen,Girl in the Cadillac,Trial by Jury,Wagons East,Highlander,Birdland,Secret Sins of the Father,Under Investigation,The X-Files,True Romance,The Return of Ironside,Homicide: Life on the Street,Extreme Justice,Poisoned by Love: The Kern County Murders,Renegade,School Ties,Hitz,Calendar Girl, Cop, Killer? The Bambi Bembenek Story,Star Trek: The Next Generation,Golden Years,The Rocketeer,Monsters,My Blue Heaven,Father Dowling Mysteries,Kojak: Flowers for Matty,Born on the Fourth of July,Booker,Fat Man and Little Boy,Tennessee Waltz,Gleaming the Cube,Chief Zabu,Goodbye, Miss 4th of July,The Equalizer,Revenge of the Nerds II: Nerds in Paradise,Murder, She Wrote,Ohara,The Magical World of Disney,Miami Vice,Firefighter,The Last Days of Patton,Raw Deal,Screen Two,3:15 the Moment of Truth,Youngblood,The Defiant Ones,Our Family Honor,Death Wish 3,Real Genius,Girls Just Want to Have Fun,Nickel Mountain,Crazy Like a Fox,The Cartier Affair,The Three Wishes of Billy Grier,Finders Keepers,Automan,The A-Team,Lassiter,The Yellow Rose,CBS Schoolbreak Special,The Seduction of Gina,Magnum, P.I.,The Big Score,Manimal,Hardcastle and McCormick,Cujo,Eureka,St. Elsewhere,Simon & Simon,Timerider: The Adventure of Lyle Swann,Rooster,In the Custody of Strangers,The Amateur,Nero Wolfe,Death Hunt,Alcatraz: The Whole Shocking Story,Guyana Tragedy: The Story of Jim Jones,B.J. and the Bear,The Boy Who Drank Too Much,Hawaii Five-O,The Misadventures of Sheriff Lobo,Undercover with the KKK,Love's Savage Fury,The Jericho Mile,Greatest Heroes of the Bible,Magic,The Clone Master,Coming Attractions,How the West Was Won,The Oregon Trail,The Chicken Chronicles,The Rockford Files,Charlie's Angels,The White Buffalo,King Kong,Family Plot,Police Story,Kate McShane,Breakheart Pass,French Connection II,Last Hours Before Morning,Requiem for a Nun,Baretta,A Shadow in the Streets,Satan's Triangle,The Godchild,The New Land,The Longest Yard,Kojak,The Midnight Man,The Waltons,The Migrants,Executive Action,The Last American Hero,Class of '63,Lolly-Madonna XXX,The Streets of San Francisco,Ironside,Rage,Dirty Little Billy,Bad Company,Hickey & Boggs,The New Centurions,The Magnificent Seven Ride!,Cannon,Longstreet,Mannix,Dark Shadows: The Vampire Curse"
Elvy,"Resident Alien,Everyone Is Doing Great,Mank,The Interpreter,Flicker Free,A Futile and Stupid Gesture,Alex & The List,The Catch,The Circle,The Music,The Automatic Hate,How to Speak Clearly,Oldboy,Brightest Star,Howard Cantour.com,I Am Ben,Mildred Pierce,Southland,The Office,Bandslam,Cold Case"
Majandra Delfino,"Later Days,Awokened,BoJack Horseman,Life in Pieces,Band Aid,Nerd Herd,Friends with Better Lives,Brooklyn Decker Threesome,The Office,Family Trap,State of Georgia,Men of a Certain Age,Life as We Know It,Bent,Pulling,Web of Lies,Heidi 4 Paws,Quarterlife,Three Moons Over Milford,Ultra,Help Me Help You,Don't Come Knocking,State's Evidence,Celeste in the City,Boston Public,Reeseville,Roswell,R.S.V.P.,Dirty Laundry,Traffic,Shriek If You Know What I Did Last Friday the Thirteenth,Katie Joplin,The Learning Curve,The Secret Life of Girls,The Tony Danza Show,Zeus and Roxanne"
Kwame Boateng,"Jay-Z: Legacy,Life Boat,Liza Liza: Skies Are Grey,I Am Potential,Teacher of the Year,They Die by Dawn,Workaholics,The Chicago Code,Faith and Dreams,The Office,ER,The Least Among You,Not Easily Broken,The Norton Avenue All-Stars,The Onion Movie,Everybody Hates Chris,Entourage,All of Us,Punk'd"
Michael McCartney,"Home Plate,Gaslit,The Last Son,Crosscut,Closure,Very Grave Robbers,The Millionaires,The Millionaires,The Last Survivors,Glass Chin,Ascend,Dealing,A Telephone Call,The Office,Welgünzêr,The Grand Inquisitor,Neal Cassady,The Convention,Conviction,Law & Order,Bandidos,Law & Order: Criminal Intent,Confess,Today Will Be Yesterday Tomorrow,Bringing Rain,Halloween: Resurrection,Law & Order: Special Victims Unit,Saving Manhattan"
Sarah Baker,"Bob's Burgers,The Kominsky Method,The Great North,Thunder Force,Bless the Harts,Young Sheldon,Superintelligence,Will & Grace,The Conners,Harvey Girls Forever!,Life in Pieces,Jack,The Death of Dick Long,Dan the Weatherman,I Feel Bad,Smallfoot,A Simple Favor,Door No. 1,Life of the Party,New Girl,Brooklyn Nine-Nine,Santa Clarita Diet,Modern Family,Electric Dreams,Untitled Kourtney Kang Project,Great News,Graves,Ghosted,Speech & Debate,Big Little Lies,Dr. Ken,Foursome,The Last Word,Sofia the First,Hail Mary,Comedy Bang! Bang!,Better Things,Goliath,Mascots,Brother Nature,TripTank,Grace and Frankie,Idiotsitter,Workaholics,In-Between,Mike Tyson Mysteries,Rock the Kasbah,Your Pretty Face Is Going to Hell,Fresh Off the Boat,The Meddler,Married,Key and Peele,Hot Girl Walks by,Other Space,Mike & Molly,A to Z,Last Week Tonight with John Oliver,The Good Lie,Tammy,Planet of the Baybes,Louie,The Crazy Ones,Bagels: The Movie,Sean Saves the World,Go On,The Campaign,In Gayle We Trust,Home for Actresses,Bones,Good Luck Charlie,The Office,In the Motherhood,Free Radio,Kath & Kim,The Lance Krall Show,Party Animals,Sweet Home Alabama,Whole World Comedy"
Chris Ellis,"Tightrope,Homecoming,9-1-1: Lone Star,Gaslight,Silo,Carrier,Young Sheldon,Kenny,The Oath,What Still Remains,Amelia 2.0,Pitching Tents,The Show,Hand of God,Trigger,K.C. Undercover,Murder in the First,Mad Men,McFarland, USA,Jessabelle,Sequestered,Legit,Faults,The Guest,Grace Unplugged,Warehouse 13,Political Animals,The Dark Knight Rises,The Finder,Harry's Law,In Plain Sight,Pistachio - The Little Boy That Woodn't,Law & Order: LA,CSI: Crime Scene Investigation,Fairly Legal,The Mentalist,The Good Guys,Zeke and Luther,Justified,The Office,Teenage Dirtbag,G-Force,Terminator: The Sarah Connor Chronicles,Knight Rider,Cold Case,Gospel Hill,Burn Notice,Crazy,The Third Nail,The Unit,Live Free or Die Hard,Transformers,The Memory Thief,Veronica Mars,Las Vegas,The Darkroom,Vanished,Ghost Whisperer,The West Wing,Criminal Minds,Believe in Me,Fun with Dick and Jane,Death to the Supermodels,Silver Bells,CSI: NY,Sissy Frenchfry,The Devil's Rejects,The Island,Revelations,NCIS,Tiger Cruise,Helter Skelter,Death and Texas,In Enemy Hands,Line of Fire,JAG,Wonderland,Lucky,The Bus Stops Here,My Dinner with Jimi,Catch Me If You Can,Alias,The Practice,Birds of Prey,Six Feet Under,First Monday,Love Liza,Rip It Off,Domestic Disturbance,Planet of the Apes,Daddy and Them,Diagnosis Murder,Family Law,Roswell,The Watcher,Harsh Realm,The Last Marshal,Arli$$,Atomic Train,October Sky,Max Q,Promised Land,Home Fries,Armageddon,Godzilla,From the Earth to the Moon,The Pentagon Wars,Wag the Dog,Sparkler,On the Line,Bean,Con Air,Chicago Hope,The Pretender,Millennium,Her Costly Affair,Sticks & Stones,That Thing You Do!,If These Walls Could Talk,Space: Above and Beyond,The X-Files,Innocent Victims,Murder One,The Tie That Binds,Apollo 13,Crimson Tide,A Little Princess,In the Line of Duty: The Price of Vengeance,Ghost in the Machine,Addams Family Values,NYPD Blue,Melrose Place,Undercover Blues,Desperate Rescue: The Cathy Mahone Story,My Cousin Vinny,Days of Thunder,Mylène Farmer: Pourvu qu'elles soient douces (Libertine II),Chiefs,Rascals and Robbers: The Secret Adventures of Tom Sawyer and Huck Finn,The Suicide's Wife"
Dan Bakkedahl,"Alive and Kicking,Not an Artist,Sick Girl,American Crime Story,The Starling,The Goldbergs,Made for Love,Every Year on My Half Birthday,Puppy Dog Pals,Teen Titans Go!,Space Force,Tales from the Loop,Married Young,Life in Pieces,Veep,Sword of Trust,Buddy Games,Corporate Animals,The One Minute Joe Show,Holy Moses,Legend of the Three Caballeros,Action Point,Taco Shop,Tarantula,Battle of the Sexes,Killing Hasselhoff,Man Seeking Woman,Brave New Jersey,TripTank,Another Evil,The Mindy Project,Trumbo,Hitman: Agent 47,The Escort,Battle Creek,Sin City Saints,Get Hard,Newsreaders,Brooklyn Nine-Nine,Bad Judge,Gotham,Major Crimes,Californication,Legit,Not Safe for Work,Chu and Blossom,Grimm,The Heat,Four Dogs,This Is 40,The League,The Book Club,Community,Voula,Curb Your Enthusiasm,United States of Tara,Marriage Drama,Hot in Cleveland,Mayne Street,Our Show,How I Met Your Mother,Welcome to Academia,Snake 'n' Bacon,Observe and Report,Dollhouse,The Office,My First Kidnapping,The Return of Jezebel James,Flight of the Conchords,The Daily Show,30 Rock,Crime Fiction,Law & Order,Blitz: The League,Mortal Kombat: Shaolin Monks,One Man's Ceiling"
Wendi McLendon-Covey,"Sick Girl,Paint,The Goldbergs,Big City Greens,Marvel's M.O.D.O.K.,Birdgirl,Solar Opposites,Long Weekend,Barb and Star Go to Vista Del Mar,Puppy Dog Pals,Reno 911!,Crossing Swords,Sylvie's Love,Braking for Whales,Mike Tyson Mysteries,Aly & AJ: Star Maps,The News Tank,Bob's Burgers,Blush,Schooled,What Men Want,Goosebumps 2: Haunted Halloween,Papi Chulo,Blaze and the Monster Machines,Status Update,The Goldbergs: 1990-Something,Pickle and Peanut,Tales from Radiator Springs,Mark Felt: The Man Who Brought Down the White House,The Mix Up,Speech & Debate,American Dad!,Army of One,Last Week Tonight with John Oliver,Long Live the Royals,The Breakup Girl,Hello, My Name Is Doris,A Merry Friggin' Christmas,Think Like a Man Too,Blended,TripTank,The Single Moms Club,Date and Switch,Cuban Fury,I Hate My Teenage Daughter,All American Christmas Carol,10 Rules for Sleeping Around,Modern Family,Rules of Engagement,Kings of Van Nuys,Waffle Hut,Wedding Band,Blake Shelton's Not So Family Christmas,The Looney Tunes Show,What to Expect When You're Expecting,The Soup,Christmas Is Ruined,Holiday Road,Hot in Cleveland,Fully Loaded,Svetlana,Bridesmaids,Cougar Town,Sometimes Pretty Girls,Dick Tracy Special,Prenatal Pole Dancing DVD,The Search for Santa Paws,Starlight & Superfish,Public Relations,Tug,Douchebag,Rise and Fall of Tuck Johnson,Creepshow Raw: Insomnia,Wizards of Waverly Place,10 Things I Hate About You,Jesus People: The Movie,Spooner,Boutonniere,Kath & Kim,The Office,Greek,Over Her Dead Body,G.I.L.F.,Goldfish,Closing Escrow,Reno 911! Miami,Cook Off!,Lovespring International,Bewitched,Henry and Marvin"
Kelsea Button,"Spring Break '83,Man Without a Head,The Face in the Vial,Modern Family,The All-American Rejects: Gives You Hell,Float,Timesick Blues,The Office,The Spare Room,The Gay Bed and Breakfast of Terror,The Difference"
